{
	"title": "Pirate Hat",
	"id": "cosmetic-pirate",
	"modelType": "cosmetic",
	"rarity": "common",
	"maxStackSize": 1,
	"tooltips": [],
	"shopPurchasable": {
	"priceDabloons": 50,
		"description": "Unlock the Pirate Hat cosmetic.",
		"unlockWeight": 100,
		"unlockMessage": "Unlocked cosmetic: Pirate Hat."
	},
	"equippableCosmetic": {}
}
