{
	"title": "Book Stack",
	"id": "cosmetic-book-stack",
	"modelType": "cosmetic",
	"rarity": "common",
	"maxStackSize": 1,
	"tooltips": [
		"A stack of some nostalgic, iconic books."
	],
	"shopPurchasable": {
		"priceDabloons": 35,
		"description": "A stack of some nostalgic, iconic books.",
		"unlockWeight": 50,
		"unlockMessage": "Unlocked cosmetic: Book Stack."
	},
	"equippableCosmetic": {}
}
