{
	"title": "Ice Cream Hat",
	"id": "cosmetic-ice-cream",
	"modelType": "cosmetic",
	"rarity": "common",
	"maxStackSize": 1,
	"tooltips": [],
	"shopPurchasable": {
		"priceDabloons": 35,
		"description": "",
		"unlockWeight": 50,
		"unlockMessage": "Unlocked cosmetic: Ice Cream Hat."
	},
	"equippableCosmetic": {},
	"dyeable": {
		"tintColor": "#835432"
	}
}
