{
	"title": "Propeller Hat",
	"id": "cosmetic-propeller",
	"modelType": "cosmetic",
	"rarity": "common",
	"maxStackSize": 1,
	"tooltips": [],
	"shopPurchasable": {
		"priceDabloons": 35,
		"description": "A wardrobe cosmetic unlock for Propeller Hat.",
		"unlockWeight": 25,
		"unlockMessage": "Unlocked cosmetic: Propeller Hat."
	},
	"equippableCosmetic": {}
}
