{
	"title": "Mooneel",
	"id": "fish-mooneel",
	"modelType": "basic",
	"rarity": "rare",
	"maxStackSize": 64,
	"tooltips": [
		"It rises from deep crevices only when moonlight reaches the water."
	],
	"fish": {
		"angle": "BL",
		"tags": [
			"waning"
		],
		"size": {
			"averageLengthCm": 120,
			"textureLengthPixels": 18.384776
		},
		"furnaceResult": "white_meat"
	}
}
