{
	"title": "Sombreronn",
	"id": "cosmetic-sombreronn",
	"modelType": "cosmetic",
	"rarity": "legendary",
	"maxStackSize": 1,
	"tooltips": ["Nevermind, this may be too big O.o"],
	"shopPurchasable": {
		"gameplayToggle": "inventors",
		"membersOnly": false,
		"priceDabloons": 300,
		"description": "",
		"unlockWeight": 10,
		"unlockMessage": "Unlocked cosmetic: Sombreronn.",
		"tags": ["mexican", "mexico", "sun hat", "large", "big", "huge", "giant"]
	},
	"equippableCosmetic": {}
}
