{
	"title": "Amogus Hat",
	"id": "cosmetic-amogus",
	"modelType": "cosmetic",
	"rarity": "common",
	"maxStackSize": 1,
	"tooltips": [
		"When the impostor is sus"
	],
	"shopPurchasable": {
		"priceDabloons": 35,
		"description": "",
		"unlockWeight": 100,
		"unlockMessage": "Unlocked cosmetic: Amogus Hat."
	},
	"equippableCosmetic": {},
	"dyeable": {
		"tintColor": "#FF0000"
	}
}
