{
	"title": "Sun Hat",
	"id": "cosmetic-sun-hat",
	"modelType": "cosmetic",
	"rarity": "common",
	"maxStackSize": 1,
	"tooltips": ["Perfect for vampires"],
	"shopPurchasable": {
		"membersOnly": false,
		"priceDabloons": 42,
		"description": "",
		"unlockWeight": 10000,
		"unlockMessage": "Unlocked cosmetic: Sun Hat.",
		"tags": ["beach", "straw hat"]
	},
	"equippableCosmetic": {},
	"dyeable": {
		"tintColor": "#f1337f"
	}
}
