{
	"title": "Magic Backpack",
	"id": "charm-magic-backpack",
	"modelType": "basic",
	"rarity": "rare",
	"maxStackSize": 1,
	"tooltips": [
		"Right click to open.",
		"Holds 27 slots."
	],
	"charm": {
		"charmId": 46,
		"minLevel": 1,
		"maxLevel": 1,
		"levels": [
			{
				"level": 1,
				"abilityStatusCurrent": "Opens a 27-slot backpack when used.",
				"abilityStatusRelative": "",
				"upgradeIngredients": []
			}
		]
	}
}
