{
	"title": "Anchovy",
	"id": "fish-anchovy",
	"modelType": "basic",
	"rarity": "common",
	"maxStackSize": 64,
	"tooltips": [
		"Anchovies form immense schools whose synchronized turns confuse predators."
	],
	"fish": {
		"angle": "L",
		"tags": [
			"ocean"
		],
		"size": {
			"averageLengthCm": 15,
			"textureLengthPixels": 12
		},
		"furnaceResult": "red_meat"
	}
}
