{
	"title": "Candle",
	"id": "cosmetic-candle",
	"modelType": "cosmetic",
	"rarity": "common",
	"maxStackSize": 1,
	"tooltips": [],
	"shopPurchasable": {
		"priceDabloons": 35,
		"description": "A wardrobe cosmetic unlock for Candle.",
		"unlockPriority": 0
	},
	"equippableCosmetic": {},
	"dyeable": {
		"tintColor": "#d8d29d"
	}
}
