{
	"title": "Cloudy Crab",
	"id": "fish-cloudy_crab",
	"modelType": "basic",
	"rarity": "uncommon",
	"maxStackSize": 64,
	"tooltips": [
		"A haze of pale hairs makes its shell resemble a drifting cloud."
	],
	"fish": {
		"angle": "T",
		"tags": [
			"rainy"
		],
		"size": {
			"averageLengthCm": 18,
			"textureLengthPixels": 14
		},
		"furnaceResult": "crab_claw"
	}
}
