{
	"title": "Sea Scorpion",
	"id": "cosmetic-sea-scorpion",
	"modelType": "cosmetic",
	"rarity": "common",
	"maxStackSize": 1,
	"tooltips": [
		"As seen in 480 million BCE!"
	],
	"shopPurchasable": {
		"priceDabloons": 35,
		"description": "",
		"unlockWeight": 10,
		"unlockMessage": "Unlocked cosmetic: Sea Scorpion."
	},
	"equippableCosmetic": {}
}
