{
	"title": "Cave Spider Pajamas Charm",
	"id": "charm-cave-spider-pajamas",
	"modelType": "charm",
	"rarity": "common",
	"maxStackSize": 1,
	"tooltips": ["Poison not included."],
	"charm": {
		"charmId": 20,
		"minLevel": 1,
		"maxLevel": 1,
		
		"levels": [
			{
				"level": 1,
				"abilityStatusCurrent": "Lets you hold jump to move across ceilings while equipped.",
				"abilityStatusRelative": "",
				"upgradeIngredients": []
			}
		]
	},
	"equippableCharm": {
		"equipmentSlot": "legs",
		"equippableAssetId": "cave_spider_pajamas__charm"
	}
}
