{
	"title": "Deformed Carp",
	"id": "fish-deformed_carp",
	"modelType": "basic",
	"rarity": "uncommon",
	"maxStackSize": 64,
	"tooltips": [
		"Its crooked spine produces an erratic dart that predators struggle to predict."
	],
	"fish": {
		"angle": "BL",
		"tags": [
			"river"
		],
		"size": {
			"averageLengthCm": 55,
			"textureLengthPixels": 18.384776
		},
		"furnaceResult": "white_meat"
	}
}
