{
	"title": "Skull Hat",
	"id": "cosmetic-skull",
	"modelType": "cosmetic",
	"rarity": "common",
	"maxStackSize": 1,
	"tooltips": [],
	"shopPurchasable": {
		"priceDabloons": 35,
		"description": "Unlock the Skull Hat cosmetic.",
		"unlockWeight": 100,
		"unlockMessage": "Unlocked cosmetic: Skull Hat."
	},
	"equippableCosmetic": {}
}
