{
	"title": "Thunderfin",
	"id": "fish-thunderfin",
	"modelType": "basic",
	"rarity": "uncommon",
	"maxStackSize": 64,
	"tooltips": [
		"Charged cells along its fins crackle when storm pressure falls."
	],
	"fish": {
		"angle": "BL",
		"tags": [
			"thunderstorm"
		],
		"size": {
			"averageLengthCm": 45,
			"textureLengthPixels": 19.79899
		},
		"furnaceResult": "red_meat"
	}
}
